{
  "note": "Prices are demo — verify locally against the pack MRP before filming. price and costPrice are integer rupees per selling unit: per litre for unit L (milk, curd), per pack/jar/box otherwise. Supplier phone numbers are read from .env via phoneEnv (E.164, e.g. +9198XXXXXXXX) and never committed.",
  "shop": {"id": "murugan_dairy", "name": "Murugan Dairy", "city": "Chennai", "currency": "INR", "timezone": "Asia/Kolkata"},
  "products": [
    {"sku": "aavin_milk_500ml", "name": "Aavin Milk 500 ml", "brand": "Aavin", "pack": "500 ml pouch",
     "unit": "L", "packSizeL": 0.5, "defaultPack": true,
     "price": 44, "costPrice": 40, "reorderThreshold": 5, "shelfLifeDays": 2,
     "aliases": {"ta": ["ஆவின் பால் அரை லிட்டர்", "அரை லிட்டர் பால்", "ஆவின் பால்", "பால்"],
                 "hi": ["आविन दूध आधा लीटर", "आधा लीटर दूध", "आविन दूध", "दूध"],
                 "en": ["aavin milk half litre", "half litre milk", "aavin milk", "milk"]}},
    {"sku": "aavin_milk_1l", "name": "Aavin Milk 1 L", "brand": "Aavin", "pack": "1 L pouch",
     "unit": "L", "packSizeL": 1, "defaultPack": false,
     "price": 44, "costPrice": 40, "reorderThreshold": 5, "shelfLifeDays": 2,
     "aliases": {"ta": ["ஆவின் பால் ஒரு லிட்டர்", "ஒரு லிட்டர் பால்", "ஆவின் பால்", "பால்"],
                 "hi": ["आविन दूध एक लीटर", "एक लीटर दूध", "आविन दूध", "दूध"],
                 "en": ["aavin milk one litre", "one litre milk", "aavin milk", "milk"]}},
    {"sku": "sakthi_curd_500ml", "name": "Sakthi Curd 500 ml", "brand": "Sakthi", "pack": "500 ml pack",
     "unit": "L", "packSizeL": 0.5, "defaultPack": false,
     "price": 60, "costPrice": 52, "reorderThreshold": 3, "shelfLifeDays": 5,
     "aliases": {"ta": ["சக்தி தயிர் அரை லிட்டர்", "அரை லிட்டர் தயிர்", "சக்தி தயிர்", "தயிர்"],
                 "hi": ["शक्ति दही आधा लीटर", "आधा लीटर दही", "शक्ति दही", "दही"],
                 "en": ["sakthi curd half litre", "half litre curd", "sakthi curd", "curd"]}},
    {"sku": "sakthi_curd_1l", "name": "Sakthi Curd 1 L", "brand": "Sakthi", "pack": "1 L pack",
     "unit": "L", "packSizeL": 1, "defaultPack": true,
     "price": 60, "costPrice": 50, "reorderThreshold": 5, "shelfLifeDays": 5,
     "aliases": {"ta": ["சக்தி தயிர் ஒரு லிட்டர்", "ஒரு லிட்டர் தயிர்", "சக்தி தயிர்", "தயிர்"],
                 "hi": ["शक्ति दही एक लीटर", "एक लीटर दही", "शक्ति दही", "दही"],
                 "en": ["sakthi curd one litre", "one litre curd", "sakthi curd", "curd"]}},
    {"sku": "aavin_buttermilk_200ml", "name": "Aavin Buttermilk 200 ml", "brand": "Aavin", "pack": "200 ml pouch",
     "unit": "pack", "packSizeL": 0.2, "defaultPack": true,
     "price": 10, "costPrice": 8, "reorderThreshold": 10, "shelfLifeDays": 2,
     "aliases": {"ta": ["ஆவின் மோர்", "மோர் பாக்கெட்", "மோர்"],
                 "hi": ["आविन छाछ", "छाछ का पैकेट", "छाछ"],
                 "en": ["aavin buttermilk", "buttermilk", "moru", "chaas"]}},
    {"sku": "aavin_ghee_200ml", "name": "Aavin Ghee 200 ml", "brand": "Aavin", "pack": "200 ml jar",
     "unit": "jar", "packSizeL": 0.2, "defaultPack": true,
     "price": 160, "costPrice": 140, "reorderThreshold": 2, "shelfLifeDays": 270,
     "aliases": {"ta": ["ஆவின் நெய் இருநூறு மில்லி", "சின்ன நெய்", "நெய்"],
                 "hi": ["आविन घी दो सौ एमएल", "छोटा घी", "घी"],
                 "en": ["aavin ghee 200 ml", "small ghee jar", "ghee"]}},
    {"sku": "aavin_ghee_500ml", "name": "Aavin Ghee 500 ml", "brand": "Aavin", "pack": "500 ml jar",
     "unit": "jar", "packSizeL": 0.5, "defaultPack": false,
     "price": 380, "costPrice": 340, "reorderThreshold": 2, "shelfLifeDays": 270,
     "aliases": {"ta": ["ஆவின் நெய் அரை லிட்டர்", "பெரிய நெய்", "நெய்"],
                 "hi": ["आविन घी आधा लीटर", "बड़ा घी", "घी"],
                 "en": ["aavin ghee 500 ml", "big ghee jar", "ghee"]}},
    {"sku": "aavin_paneer_200g", "name": "Aavin Paneer 200 g", "brand": "Aavin", "pack": "200 g pack",
     "unit": "pack", "packSizeG": 200, "defaultPack": true,
     "price": 100, "costPrice": 85, "reorderThreshold": 3, "shelfLifeDays": 7,
     "aliases": {"ta": ["ஆவின் பனீர்", "பனீர்"],
                 "hi": ["आविन पनीर", "पनीर"],
                 "en": ["aavin paneer", "paneer"]}},
    {"sku": "aavin_butter_100g", "name": "Aavin Butter 100 g", "brand": "Aavin", "pack": "100 g pack",
     "unit": "pack", "packSizeG": 100, "defaultPack": true,
     "price": 55, "costPrice": 48, "reorderThreshold": 3, "shelfLifeDays": 90,
     "aliases": {"ta": ["ஆவின் வெண்ணெய்", "வெண்ணெய்"],
                 "hi": ["आविन मक्खन", "मक्खन"],
                 "en": ["aavin butter", "butter"]}},
    {"sku": "arun_icecream_box", "name": "Arun Ice Cream Family Box", "brand": "Arun", "pack": "family box",
     "unit": "box", "defaultPack": true,
     "price": 180, "costPrice": 150, "reorderThreshold": 3, "shelfLifeDays": 180,
     "aliases": {"ta": ["அருண் ஐஸ்கிரீம் பாக்ஸ்", "ஐஸ்கிரீம் பெட்டி", "ஐஸ்கிரீம்"],
                 "hi": ["अरुण आइसक्रीम बॉक्स", "आइसक्रीम का डिब्बा", "आइसक्रीम"],
                 "en": ["arun ice cream box", "ice cream box", "arun family pack", "ice cream"]}}
  ],
  "suppliers": [
    {"id": "aavin_vendor", "name": "Aavin vendor", "channel": "whatsapp", "phoneEnv": "SUPPLIER_PHONE_AAVIN_VENDOR",
     "products": ["aavin_milk_500ml", "aavin_milk_1l", "aavin_buttermilk_200ml", "aavin_ghee_200ml", "aavin_ghee_500ml", "aavin_paneer_200g", "aavin_butter_100g"],
     "aliases": {"ta": ["ஆவின் வியாபாரி", "பால் வியாபாரி", "பால்காரர்"],
                 "hi": ["आविन वाले", "दूध वाले"],
                 "en": ["aavin vendor", "milk vendor", "milkman", "aavin agent"]}},
    {"id": "sakthi_vendor", "name": "Sakthi curd vendor", "channel": "whatsapp", "phoneEnv": "SUPPLIER_PHONE_SAKTHI_VENDOR",
     "products": ["sakthi_curd_500ml", "sakthi_curd_1l"],
     "aliases": {"ta": ["சக்தி வியாபாரி", "தயிர் வியாபாரி"],
                 "hi": ["शक्ति वाले", "दही वाले"],
                 "en": ["sakthi vendor", "curd vendor", "sakthi agent"]}},
    {"id": "arun_distributor", "name": "Arun ice cream distributor", "channel": "call", "phoneEnv": "SUPPLIER_PHONE_ARUN_DISTRIBUTOR",
     "products": ["arun_icecream_box"],
     "aliases": {"ta": ["அருண் விநியோகஸ்தர்", "ஐஸ்கிரீம் விநியோகஸ்தர்"],
                 "hi": ["अरुण डिस्ट्रीब्यूटर", "आइसक्रीम वाले"],
                 "en": ["arun distributor", "ice cream distributor", "arun agent"]}}
  ]
}
